{
  "$schema": "../../../schemas/metadata.schema.json",
  "schema_version": "1.0",
  "entity_type": "projection",
  "entity_name": "MpOrderLineTurnover",
  "entity_index": "p909",
  "collection_name": "mp_order_line_turnovers",
  "table_name": "p909_mp_order_line_turnovers",
  "ui": {
    "element_name": "MP Order Line Turnovers",
    "element_name_en": "MP Order Line Turnovers",
    "list_name": "MP Order Line Turnovers",
    "list_name_en": "MP Order Line Turnovers",
    "icon": "database"
  },
  "ai": {
    "description": "Универсальная проекция оборотов по строкам заказов маркетплейсов. Одна запись = один turnover_code по одной строке заказа, одному событию строки и одному layer.",
    "questions": [
      "Какие обороты по строкам заказов есть за период?",
      "Какой layer доступен по строке заказа: plan, oper или fact?",
      "Какой turnover_code дает выручку, комиссию, логистику или количество?",
      "Какие строки заказа связаны только с p903 без a015?"
    ],
    "related": [
      "a012_wb_sales",
      "a015_wb_orders",
      "p903_wb_finance_report",
      "p910_mp_unlinked_turnovers"
    ],
    "tags": [
      "wb",
      "ym",
      "bi",
      "projection"
    ]
  },
  "fields": [
    {
      "name": "id",
      "rust_type": "String",
      "field_type": "primitive",
      "source": "specific",
      "ui": {
        "label": "ID",
        "visible_in_list": true,
        "visible_in_form": false
      },
      "validation": {
        "required": true
      },
      "ai_hint": "Стабильный business key строки проекции."
    },
    {
      "name": "connection_mp_ref",
      "rust_type": "String",
      "field_type": "aggregate_ref",
      "source": "specific",
      "ui": {
        "label": "Connection",
        "visible_in_list": true,
        "visible_in_form": false
      },
      "validation": {
        "required": true
      },
      "ai_hint": "UUID кабинета маркетплейса.",
      "ref_aggregate": "a006_connection_mp"
    },
    {
      "name": "order_key",
      "rust_type": "String",
      "field_type": "primitive",
      "source": "specific",
      "ui": {
        "label": "Order Key",
        "visible_in_list": true,
        "visible_in_form": false
      },
      "validation": {
        "required": true
      },
      "ai_hint": "Бизнес-ключ заказа."
    },
    {
      "name": "line_key",
      "rust_type": "String",
      "field_type": "primitive",
      "source": "specific",
      "ui": {
        "label": "Line Key",
        "visible_in_list": true,
        "visible_in_form": false
      },
      "validation": {
        "required": true
      },
      "ai_hint": "Бизнес-ключ строки заказа."
    },
    {
      "name": "line_event_key",
      "rust_type": "String",
      "field_type": "primitive",
      "source": "specific",
      "ui": {
        "label": "Line Event Key",
        "visible_in_list": false,
        "visible_in_form": false
      },
      "validation": {
        "required": true
      },
      "ai_hint": "Стабильный ключ события строки для idempotent rebuild."
    },
    {
      "name": "event_kind",
      "rust_type": "String",
      "field_type": "enum",
      "source": "specific",
      "ui": {
        "label": "Event Kind",
        "visible_in_list": true,
        "visible_in_form": false
      },
      "validation": {
        "required": true
      },
      "ai_hint": "Тип события строки: ordered, sold, returned, fee, adjustment, other.",
      "enum_values": [
        "ordered",
        "sold",
        "returned",
        "fee",
        "adjustment",
        "other"
      ]
    },
    {
      "name": "entry_date",
      "rust_type": "String",
      "field_type": "primitive",
      "source": "specific",
      "ui": {
        "label": "Entry Date",
        "visible_in_list": true,
        "visible_in_form": false
      },
      "validation": {
        "required": true
      },
      "ai_hint": "Бизнес-дата события."
    },
    {
      "name": "layer",
      "rust_type": "String",
      "field_type": "enum",
      "source": "specific",
      "ui": {
        "label": "Layer",
        "visible_in_list": true,
        "visible_in_form": false
      },
      "validation": {
        "required": true
      },
      "ai_hint": "Слой оборота: plan, oper или fact.",
      "enum_values": [
        "plan",
        "oper",
        "fact"
      ]
    },
    {
      "name": "turnover_code",
      "rust_type": "String",
      "field_type": "primitive",
      "source": "specific",
      "ui": {
        "label": "Turnover Code",
        "visible_in_list": true,
        "visible_in_form": false
      },
      "validation": {
        "required": true
      },
      "ai_hint": "Код оборота из классификатора turnover classes."
    },
    {
      "name": "value_kind",
      "rust_type": "String",
      "field_type": "enum",
      "source": "specific",
      "ui": {
        "label": "Value Kind",
        "visible_in_list": true,
        "visible_in_form": false
      },
      "validation": {
        "required": true
      },
      "ai_hint": "Тип значения оборота: money, quantity, percent, coefficient.",
      "enum_values": [
        "money",
        "quantity",
        "percent",
        "coefficient"
      ]
    },
    {
      "name": "agg_kind",
      "rust_type": "String",
      "field_type": "enum",
      "source": "specific",
      "ui": {
        "label": "Aggregation Kind",
        "visible_in_list": false,
        "visible_in_form": false
      },
      "validation": {
        "required": true
      },
      "ai_hint": "Правило агрегации для BI: sum, avg, last, none.",
      "enum_values": [
        "sum",
        "avg",
        "last",
        "none"
      ]
    },
    {
      "name": "amount",
      "rust_type": "f64",
      "field_type": "primitive",
      "source": "specific",
      "ui": {
        "label": "Amount",
        "visible_in_list": true,
        "visible_in_form": false
      },
      "validation": {
        "required": true
      },
      "ai_hint": "Значение оборота в конкретном layer."
    },
    {
      "name": "nomenclature_ref",
      "rust_type": "Option<String>",
      "field_type": "aggregate_ref",
      "source": "specific",
      "ui": {
        "label": "Nomenclature",
        "visible_in_list": false,
        "visible_in_form": false
      },
      "validation": {
        "required": false
      },
      "ai_hint": "Ссылка на a004_nomenclature.",
      "ref_aggregate": "a004_nomenclature"
    },
    {
      "name": "marketplace_product_ref",
      "rust_type": "Option<String>",
      "field_type": "aggregate_ref",
      "source": "specific",
      "ui": {
        "label": "Marketplace Product",
        "visible_in_list": false,
        "visible_in_form": false
      },
      "validation": {
        "required": false
      },
      "ai_hint": "Ссылка на a007_marketplace_product.",
      "ref_aggregate": "a007_marketplace_product"
    },
    {
      "name": "registrator_type",
      "rust_type": "String",
      "field_type": "primitive",
      "source": "specific",
      "ui": {
        "label": "Registrator Type",
        "visible_in_list": true,
        "visible_in_form": false
      },
      "validation": {
        "required": true
      },
      "ai_hint": "Тип документа-источника: a015_wb_orders, a012_wb_sales, p903_wb_finance_report."
    },
    {
      "name": "registrator_ref",
      "rust_type": "String",
      "field_type": "primitive",
      "source": "specific",
      "ui": {
        "label": "Registrator Ref",
        "visible_in_list": true,
        "visible_in_form": false
      },
      "validation": {
        "required": true
      },
      "ai_hint": "Ссылка на конкретный документ-источник."
    },
    {
      "name": "link_status",
      "rust_type": "String",
      "field_type": "enum",
      "source": "specific",
      "ui": {
        "label": "Link Status",
        "visible_in_list": true,
        "visible_in_form": false
      },
      "validation": {
        "required": true
      },
      "ai_hint": "Статус связности sibling-строк по layer.",
      "enum_values": [
        "single",
        "oper_fact",
        "oper_plan",
        "fact_plan",
        "full"
      ]
    },
    {
      "name": "created_at",
      "rust_type": "String",
      "field_type": "primitive",
      "source": "specific",
      "ui": {
        "label": "Created At",
        "visible_in_list": false,
        "visible_in_form": false
      },
      "validation": {
        "required": false
      },
      "ai_hint": "UTC timestamp создания строки проекции."
    },
    {
      "name": "updated_at",
      "rust_type": "String",
      "field_type": "primitive",
      "source": "specific",
      "ui": {
        "label": "Updated At",
        "visible_in_list": false,
        "visible_in_form": false
      },
      "validation": {
        "required": false
      },
      "ai_hint": "UTC timestamp последнего обновления строки проекции."
    }
  ]
}
